title,content,type,aspect,assess,aspect1,assess1,aspect2,assess2
5,"Một cuốn sách quá tuyệt vời mà bản thân cực kỳ tâm đắc, đọc mà cứ bị cuốn. Quan điểm và góc nhìn của tác giả thực sự quá thuyết phục đáng để đọc và chiêm nghiệm, nó đúng đôi khi với thứ trong cs không chỉ đơn giản về tài chính. Đơn giản dễ đọc dễ hiểu dễ tiếp cận, high recommend Thu gọn",0,2,5,2,5,2,5
5,mong là shop sẽ chú ý hơn ở khâu gói hàng!,0,4,3,4,3,4,3
5,"Tựa sách nói lên tất cả, bổ ích",0,2,5,2,5,2,5
5,5 sao!,0,"1,2,3,4",5,"1,2,3,4",5,"1,2,3,4",5
5,"Sách đọc khó hiểu, rút ít bài học từ sách. Vì là bán sách chứ không phải bán nội dung nên mình vẫn cho 5 sao",0,2,5,2,5,2,5
5,Mua tặng đừng hỏi gì cả,0,0,5,0,4,0,4
5,Cuốn này ai nghèo nên đọc,0,2,5,2,5,2,5
5,Hdjjdkdksnsnbsbsbhsjabsv shhavsbals s úbsjskens s xudjsnsn s d d ksjsjs,0,,,,,,
5,Đã nhận được sách..Thanks shop,0,0,5,0,5,0,5
5,"Cuốn sách đỉnh của đỉnh. Đọc về tâm lý và tài chính mà vô cùng thú dzị, k hề nhàm chán. Nên mua và đọc để có thêm kiến thức về đầu tư và tài chính nha mai fen! ?",0,2,5,2,5,2,5
5,"Nội dung hấp dẫn, bổ ích. Nên đọc và thực hành",0,2,5,2,5,2,5
5,rất hài lòng về sách,0,2,5,2,5,2,5
5,Bdbdudnd. Db djs sjs sjs hd,0,,,,,,
5,Rất ok luôn nha,0,"1,2,3,4",5,"1,2,3,4",5,"1,2,3,4",5
5,Vẫn là sách cho em gái đông nghiệp Yêu thích kinh tế học,0,2,5,2,5,2,5
5,sách đẹp,0,2,5,2,5,2,5
5,Sự giàu có là cái mà chúng ta không nhìn thấy được,0,0,5,0,5,0,5
5,Nghe đồn đọc xong quyển này sẽ hạnh phúc hihi,0,0,5,0,5,0,5
5,Nên mua,0,2,5,2,5,2,5
5,"Hữu ích, dễ hiểu. Cảm ơn tác giả đã chia sẻ",0,2,5,2,5,2,5
5,Đọc ko nỗi. Muốn đem đi pass,0,2,2,2,3,2,3
5,sách bao gói cẩn thận.,0,4,5,4,5,4,5
5,"Sách có cái nhìn trung hoà, lập luận nhiều luận cứ và ví dụ từ thực tiễn, đọc xong thấy humble",0,2,5,2,5,2,5
5,Sách nội dung bổ ích,0,2,5,2,5,2,5
5,Nên biết trước một số thuật ngữ về chứng khoán trước thì khi đọc sẽ dễ hơn,0,0,4,0,5,0,5
5,Sách bọc cẩn thận,0,4,5,4,5,4,5
5,"this is one of the psychology book that includes all of thing about how we behave with our money to be rich man, i appreciate it",0,2,5,2,5,2,5
5,Bìa với bao bì rất chỉnh chu,0,2,5,2,5,2,5
5,Này có sách nói trên ytb bạn nào muốn biết nội dung thì có thể lên nghe,0,0,5,0,5,0,5
5,Sản phẩm OK nhung ko có tấm chặn,0,2,4,2,3,2,3
5,Rất nhiều kiến thức tài chính,0,2,5,2,5,2,5
5,Nội dung tuyệt vời. Rất nên đọc!,0,2,5,2,5,2,5
5,cuốn sách mà tất cả mọi người đều nên đọc qua ít nhất 1 lần,0,2,5,2,5,2,5
5,ổn nha mn,0,"1,2,3,4",5,"1,2,3,4",4,"1,2,3,4",4
5,Góp nhặt được một vài lợi ích,0,2,5,2,5,2,5
5,Cảm ơn Tiki đã nâng niu cuốn sách của mình,0,4,5,4,5,4,5
4,Phân tích sau sát. Nhiều kiến thức cần thiết.,0,2,5,2,5,2,5
5,rất thích,0,2,5,2,5,2,5
5,Đáng đọc,0,2,5,2,5,2,5
5,nice book.,0,2,5,2,5,2,5
5,"Nhanh chóng, hài lòng",0,"2,4",5,"2,4",5,"2,4",5
4,"Sách đọc rất ok, đúng với snghi của mình",0,2,5,2,5,2,5
5,Sách toota,0,2,5,2,5,2,5
5,Rất nên đọc,0,2,5,2,5,2,5
5,sách rất đáng để bkr thời gian ra để đọc,0,2,5,2,5,2,5
5,ngon lành cành đài bà con ơi,0,2,5,2,5,2,5
5,quyển này khá,0,2,4,2,5,2,5
5,Khá ổn,0,"1,2,3,4",4,"1,2,3,4",4,"1,2,3,4",4
5,Cực bổ ích,0,2,5,2,5,2,5
5,Dễ đọc,0,2,5,2,5,2,5
5,Sách có bìa cứng nữa thì tuyệt,0,2,4,2,4,2,4
5,rất hài lòng,0,"1,2,3,4",5,"1,2,3,4",5,"1,2,3,4",5
5,nên đọcv,0,2,5,2,5,2,5
5,Oke sách đóng gỏi tôt,0,4,5,4,5,4,5
5,nên đọc,0,2,5,2,5,2,5
5,Mọi người nên đọc,0,2,5,2,5,2,5
5,Nhan hang nhanh chong,0,4,5,4,5,4,5
5,Nội dung vừa phải cho các nhà đầu tư F0,0,2,5,2,5,2,5
5,mua được 2 em này là đỉnh rồi,0,2,5,2,5,2,5
5,Không hối hận khi mua,0,2,5,2,5,2,5
5,Good to know,0,2,5,2,5,2,5
5,Sp ok,0,2,5,2,5,2,5
5,Nên đọc,0,2,5,2,5,2,5
5,Nội dung khá ổn,0,2,4,2,5,2,5
5,bìa dày dặn.chữ rõ nét,0,2,5,2,5,2,5
5,Đúng mô tả,0,2,5,2,5,2,5
5,Quá là okie luông,0,2,5,2,5,2,5
5,xèng về,0,0,5,0,5,0,5
5,Sách dễ đọc,0,2,5,2,5,2,5
5,Sách đọc ổn,0,2,5,2,5,2,5
5,Rất tuyệt vời,0,"1,2,3,4",5,"1,2,3,4",5,"1,2,3,4",5
5,1 quyển sách đáng đọc,0,2,5,2,5,2,5
5,Ok nha,0,"1,2,3,4",5,"1,2,3,4",5,"1,2,3,4",5
5,sách ok,0,2,5,2,5,2,5
5,Sách khá thú vị,0,2,5,2,5,2,5
5,đỉnh nhé mng,0,2,5,2,5,2,5
5,Đọc được,0,2,4,2,5,2,5
5,khá hấp dẫn,0,2,5,2,5,2,5
5,Rất hữu ích,0,2,5,2,5,2,5
5,Tuyet voi,0,"1,2,3,4",5,"1,2,3,4",5,"1,2,3,4",5
5,màu giấy hơi đen,0,2,3,2,5,2,5
5,ok lắm,0,"1,2,3,4",5,"1,2,3,4",4,"1,2,3,4",4
5,cuốn sách đáng để đọc.,0,2,5,2,5,2,5
5,5 sao,0,"1,2,3,4",5,"1,2,3,4",5,"1,2,3,4",5
5,Oki ạ,0,"1,2,3,4",5,"1,2,3,4",4,"1,2,3,4",4
5,Hài lòng 5 sao,0,"1,2,3,4",5,"1,2,3,4",5,"1,2,3,4",5
5,ok nha,0,"1,2,3,4",5,"1,2,3,4",4,"1,2,3,4",4
5,sách sạch sẽ,0,2,5,2,5,2,5
5,Rất ổn,0,"1,2,3,4",5,"1,2,3,4",5,"1,2,3,4",5
5,Sách dc đóng cẩn thận,0,4,5,4,5,4,5
5,quá tuyệt vời,0,"1,2,3,4",5,"1,2,3,4",5,"1,2,3,4",5
5,"giấy vàng nhẹ, ok",0,2,4,2,5,2,5
5,Sách để đầu giường@@,0,2,5,2,5,2,5
5,cực kỳ hài lòng,0,"1,2,3,4",5,"1,2,3,4",5,"1,2,3,4",5
5,Gút chop,0,"1,2,3,4",5,"1,2,3,4",5,"1,2,3,4",5
5,Đang đọc.,0,2,5,2,5,2,5
3,"Chọn Bookcare là vì mình rất thích gìn giữ sách, mà Tiki chọn ngay cuốn bị rách để gửi cho mình :(",0,4,1,4,5,4,5
1,Vote cho 1sao…sjndjidnhsbsjjsbsbnsbs sns hssnsksnsj sjbdis snsknskz sks sksnsnsb dbshsbbabs sjn. Kb nân n,0,,,,,,
1,Sách bị móp khó chịu vô cùng,0,4,1,4,3,4,3
3,"Sách bị dơ, nhận được hàng thì thấy thùng ở ngoài bị rách luôn",0,4,1,4,2,4,2
1,"Bọc sách cực tệ, không thể chấp nhận được",0,4,1,4,1,4,1
3,Sách bị lem mực khá nhiều trang,0,2,1,2,3,2,3
4,"Sách không được bọc nilong, bìa ngoài bị trầy xước và có vài vết nem bẩn. Hi vọng shop khắc phục tình trạng này",0,4,2,4,3,4,3
3,"Sách bị dính trang khá nhiều ở trên đầu, muốn đọc thì bắt buộc phải tách ra trông khá lem nhem",0,2,3,2,3,2,3
1,Sách dính các trang vào nhau,0,2,2,2,3,2,3
3,"sách ko đc bọc bì cẩn thận, nhìn ko chuyên nghiêp",0,4,3,4,2,4,2
4,"Sách hơi khó đọc, có vài điểm đáng chú ý với góc nhìn rộng",0,2,3,2,4,2,4
5,"nôi dung tạm ổn, có vài điểm nhấn",0,2,4,2,4,2,4
1,"Mua hàng chứ có đi xin đâu mà gói hàng thấy ghê, đặt 10 cuốn thì nhăn nheo hết 8",0,4,1,4,2,4,2
4,"Cảng đọc càng lú, có lé không hợp với mình",0,2,2,2,4,2,4
5,còn trầy,0,4,2,4,2,4,2
3,Sách bị hiện tượng va đập,0,4,2,4,3,4,3
4,Một cuốn sách thú vị :),0,2,5,2,5,2,5
4,"nội dung dễ hiểu, dẫn chứng từ trải nghiệm của người viết",0,2,5,2,5,2,5
4,Về nội dung mình chỉ cho 3/5 thôi . còn về sách thì không có gì để chê,0,2,4,2,4,2,4
1,"sách thiếu 16 trang, từ trang 289 đến 304",0,2,1,2,1,2,1
3,"Nội dung hữu ích, tuy nhiên sách tài chính mà người dịch không có chuyên môn lắm.",0,2,3,2,4,2,4
3,Chán chả buồn nói. Không có tâm gì cả,0,"2,4",1,"2,4",1,"2,4",1
4,Đóng hàng cẩn thận hơn nha đi ạ,0,4,2,4,3,4,3
1,Nội dung đọc xong không hiểu gì,0,2,1,2,3,2,3
5,Sách lỗi trắng trang mất nội dung ko đọc được,0,2,1,2,1,2,1
5,"nội dung ổn, dịch chán.",0,2,2,2,3,2,3
1,"2 đầu góc sách bị nhăn do gói hàng không kỹ, cực kỳ thất vọng",0,4,2,4,1,4,1
4,Sávh khá ổn!,0,2,4,2,4,2,4
4,Dễ hiểu,0,2,5,2,5,2,5
2,"Sách k được bọc nilon nhỉ, thấy bt quá",0,"2,4",2,"2,4",2,"2,4",2
3,Nội dung hữu ích Cuốn sách có khá nhiều lỗi chính tả và nhiều chỗ dịch khá khó hiểu.,0,2,2,2,3,2,3
4,Dịch thuật còn cùi lắm.,0,2,2,2,3,2,3
1,"sách dịch cực tệ, đọc rất khó hiểu",0,2,2,2,1,2,1
2,Không thực sự đặc sắc và có chiều sâu. Đọc tam được,0,2,3,2,3,2,3
4,Bìa bị bẩn và sống sách bị gãy ?,0,2,2,2,1,2,1
4,Sách bị gãy 1 góc,0,2,2,2,2,2,2
2,"đóng hàng sơ sài, sách bị mốp và gãy góc ở nhiều chổ",0,4,2,4,2,4,2
1,Ko bọc màng chống sốc nên bị móp ở nhiều chỗ,0,4,2,4,2,4,2
4,"Sách viết sơ sài, phân tích không thuyết phục",0,2,2,2,2,2,2
4,Hơi khó hiểu đối với mình,0,2,2,2,4,2,4
3,bìa xước nhiều quá huhuhuhuhu,0,2,2,2,3,2,3
4,Sách bị móp ở góc trên và dưới,0,2,2,2,2,2,2
3,nội dung sách được. mình thích nó,0,2,5,2,5,2,5
5,hơi khó hiểu so với sách tiếng Anh,0,2,4,2,4,2,4
3,sách bị quăn góc.,0,2,3,2,3,2,3
3,"k có seal sách, k có bookmark",0,4,3,4,2,4,2
4,Sản phẩm ok,0,2,5,2,5,2,5
4,"Sách không mang tính học thuật, đọc để biết thêm!",0,2,4,2,4,2,4
2,sách bọc k kĩ. bị rách góc và nhăn sách,0,4,2,4,2,4,2
5,có vài trang bị in lỗi,0,2,2,2,3,2,3
4,7.5/10 điểm,0,2,3,2,3,2,3
4,sách ahy,0,2,5,2,5,2,5
4,hài lòng về sản phẩm.,0,2,5,2,5,2,5
4,sản phẩm ok,0,2,5,2,5,2,5
2,Không có gì đặc biệt về sản phẩm,0,2,4,2,4,2,4
4,Tuyệt vời !,0,"1,2,3,4",5,"1,2,3,4",5,"1,2,3,4",5
4,Ok phết,0,2,5,2,5,2,5
1,Phân tích rất khó tiếp thu.,0,2,2,2,4,2,4
2,sách viết tương đối khó hiểu,0,2,2,2,5,2,5
3,đang đọc.,0,0,3,0,4,0,4
5,"Mình đã theo dõi cách ăn uống của chị Jessie Inchauspé trên YouTube từ rất lâu rồi và đã làm theo 10 mẹo để giảm lượng đường trong máu và chống việc bị kháng insulin, kể cả khi mình không bị tiểu đường. Bên cạnh đó, mình chơi thể thao và áp dụng cách này giúp mình giảm mỡ và xây dựng cơ thể của một vận động viên đúng nghĩa. Thu gọn",0,2,5,2,5,2,5
5,Kiến thức bổ ích,0,2,5,2,5,2,5
5,"Sách có diễn giải cụ thể, dễ hiểu. Đáng đọc.",0,2,5,2,5,2,5
5,"sách nhìn sạch sẽ, chữ in rõ nét, bìa thiết kế chỉnh chu",0,2,5,2,5,2,5
5,Rất đáng đọc nha các b siêu chữa lành huhu,0,2,5,2,5,2,5
5,câu chuyện ý nghĩa. nó đang giúp tôi mỗi ngày,0,2,5,2,5,2,5
5,Nội dung rất đáng để đọc nhé,0,2,5,2,5,2,5
5,"Nếu bạn đã từng tìm hiểu về Tỉnh thức, về đạo Phật, đã từng tìm hiểu về cái tôi, đã từng bị ""khổ"" mà khó khăn thoát ra, hãy đọc thêm cuốn này nhé. Cảm ơn tác giả rất nhiều.",0,2,5,2,5,2,5
5,"Đang lúc chơi vơi thì gặp được cuốn sách của tác giả mình yêu thích. Hào hứng đọc ngay, đọc luôn và order thêm để tặng những ngừoi bạn mà mình yêu mến",0,2,5,2,5,2,5
5,Cám ơn Mae,0,2,5,2,5,2,5
5,rất ổn không bị bóp méo gì,0,"2,4",5,"2,4",4,"2,4",4
5,"Nội dung thực tế, viết dễ hiểu",0,2,5,2,5,2,5
5,"Nội dung dễ hiểu, ví dụ thực tế, đáng đọc ạ",0,2,5,2,5,2,5
5,Sách gói cẩn thận cảm ơn nhà sách,0,4,5,4,5,4,5
4,"Sách bị xước nhiều quá ,hi vọng lần sau shop cẩn thận hơn",0,"2,4",3,"2,4",4,"2,4",4
2,Sách dở không đáng để xem,0,2,1,2,1,2,1
5,"Giấy ngã vàng dễ đọc, sách dày",0,2,5,2,5,2,5
5,"một chiến lược đầu tư tập trung cao độ, nhà đầu tư chỉ mua duy nhất một mã cổ phiếu hoặc chứng khoán vào một thời điểm nào đó. Nhiều người tin vào triết lý, càng nhiều lựa chọn thì càng dễ mắc sai, có. Xem thêm",0,0,5,0,5,0,5
5,"Nội dung sách rất bổ ích đối với mình, giúp mình hiểu ra cách để đối mặt và vượt qua những rào cản, trở ngại tinh thần, học cách mạnh mẽ và trưởng thành từ bên trong.",0,2,5,2,5,2,5
5,"Đã nhận được sách, rất hài lòng về sự chỉn chu từ TiKi. Biết ơn vì sự chỉn chu này",0,"2,4",5,"2,4",5,"2,4",5
5,"Cuốn sách đáng đọc nhất dành cho tất cả mọi người, giúp trưởng thành tinh thần",0,2,5,2,5,2,5
5,"Tâm lý học dễ hiểu cho cả người không chuyên để hiểu mình, hiểu đời hơn.",0,2,5,2,5,2,5
5,Một quyển sách tuyệt vời về tình yêu,0,2,5,2,5,2,5
5,Cuốn sách rất đáng đọc,0,2,5,2,5,2,5
5,Một cuốn sách dành cho những bạn học Tâm lý trị liệu.,0,2,5,2,5,2,5
5,nội dung sách rất sâu sắc,0,2,5,2,5,2,5
5,Nghe review trên Better version nên mua đọc thử,0,0,5,0,5,0,5
5,Ò ó o o… chạc chạc chạc,0,0,5,0,,0,
5,Great book to read,0,2,5,2,5,2,5
1,Mình mua gói bookcare mà sao lần này sách ko dc bọc cẩn thận vậy,0,4,1,4,2,4,2
5,Tuyệt vời hơn nữa! Khi có quyển sách quý này trong tay mình. Cảm ơn Tiki trading rất nhiều!,0,"0,2",5,"0,2",5,"0,2",5
5,Ok. Mua hơi sớm tí.,0,"0,2",5,"0,2",5,"0,2",5
5,Mình tìm mua vì trong quyển sách NÓI MỘT CÁCH ĐƠN GIẢN có đề cập đến. Mình tin là sách sẽ có nhiều kiến thức bổ ích.,0,2,5,2,5,2,5
5,5 sao nhé sách tuyệt vời lm ạ,0,2,5,2,5,2,5
5,rất ổn nha mọi ngưởi,0,2,5,2,5,2,5
5,ok tot,0,2,5,2,5,2,5
5,"4,5 sao",0,"0,2",5,"0,2",5,"0,2",5
5,"Good, well-organized book",0,2,5,2,5,2,5
5,Rất tuyệt vời!,0,2,5,2,5,2,5
2,"Sách bị gấp, rách, nhăn nheo. Mình khi mua và đọc sách thì giữ rất kĩ nên gặp tình trạng này khá khó chịu",0,2,2,2,2,2,2
3,Không biết có phải lỗi sai chứ không,0,"0,2",3,"0,2",3,"0,2",3
3,"sách k có bao bọc, còn bị dơ nữa",0,4,2,4,1,4,1
1,"Ủa alo, 208 nhảy đến 225 là sao",0,2,1,2,5,2,5
3,Sách đọc hơi khá hiểu. K cuốn hút,0,2,2,2,3,2,3
4,Nội dung diễn dịch còn một số chỗ mơ hồ và loạn ngữ pháp. Mong sẽ có bản vá để đọc lôi cuốn và đi vào lòng người hơn !,0,2,2,2,3,2,3
5,Đây thật sự là cuốn sách mình muốn đọc mà đó giờ ko biết tìm ntn.,0,2,4,2,5,2,5
5,sách bị rách mất 2 trang :( nội dung rất hữu ích,0,2,3,2,3,2,3
5,Sách rất ok,0,2,5,2,5,2,5
5,bọc rất ok sách không bị nhàu,0,4,5,4,5,4,5
5,hình ảnh mang tính chất nhận xu. sách sử dụng rất hữu ích,0,"0,2",5,"0,2",5,"0,2",5
5,Sách kết hợp với việc vừa xem vừa thực hành khá dễ hiểu .,0,2,5,2,5,2,5
5,Khá bổ ích,0,2,5,2,5,2,5
5,Đọc dễ hiểu do có hình minh họa,0,2,5,2,5,2,5
5,Sách rất nhiều chữ,0,2,4,2,5,2,5
5,sách hữu ích,0,2,5,2,5,2,5
5,Vượt qua mong đợi,0,2,5,2,5,2,5
5,Quá tuyệt vời,0,"1,2,3,4",5,"1,2,3,4",5,"1,2,3,4",5
4,sách nhỏ nhắn xinh xắn,0,2,5,2,5,2,5
5,Kiến thức rất bổ ích,0,2,5,2,5,2,5
5,Nội dung sách bồ ích,0,2,5,2,5,2,5
5,thú vị,0,2,5,2,5,2,5
5,Sách oke,0,2,5,2,5,2,5
3,"Có có túi bọc gì, chỉ có cuốn sách không",0,4,2,4,5,4,5
5,"Mình gacha ra cuốn có chữ ký, mình rất vui",0,0,5,0,5,0,5
5,"Bao bì chống sốc bên ngoài có hộp đựng, gọn gàng, mình rất ưng ý.",0,4,5,4,5,4,5
5,"Minh hoạ ok, kiến thức chắt lọc, sách rất phù hợp cho beginner ah",0,2,5,2,5,2,5
1,"Sách nội dung tệ quâ, mọi người cân nhắc khi mua.",0,2,1,2,3,2,3
1,Đặt bookcare mà không có,0,0,1,0,3,0,3
5,Màu sắc tranh truyện in sắc nét. Không có mùo giấy. Muốn mua hết các bộ mà sợ bé không hợp tác,0,2,5,2,4,2,4
5,"Nội dung bố ích, viết dễ hiểu. Cảm ơn tác giả và tiki",0,2,5,2,5,2,5
5,Đọc mấy trang đầu thấy khá OK,0,2,5,2,5,2,5
5,giúp ích cho tôi,0,2,5,2,5,2,5
5,Huu ivh,0,0,5,0,,0,
3,Đơn tiki nay ko đóng hộp giấy nên bị thủng rách góc sách,0,4,2,4,2,4,2
3,nội dung sách hơi bị lan man.,0,2,2,2,4,2,4
5,Quyển sách Tư duy phản biện của tác giả Albert Rutherford là một tài liệu hữu ích cho những ai muốn nâng cao khả năng suy luận và phân tích vấn đề. Tác giả đã trình bày rõ ràng các khái niệm cơ bản về. Xem thêm,0,2,5,2,5,2,5
5,I love it,0,2,5,2,5,2,5
5,"Cuốn sách đưa ra những mẫu nhận thức giúp bạn tham khảo để tư duy 1 vấn đề, 1 vài lời khuyên.",0,2,5,2,5,2,5
5,"Nên mua ạ. Chữ rõ ràng, mực không bị nhoè, nội dung bổ ích",0,2,5,2,5,2,5
5,"Bạn sẽ mua sách ngay bây giờ hoặc là sẽ không bao giờ mua sách. Mua ngay đi, Đừng nghĩ nữa.",0,0,5,0,5,0,5
5,"Sách khá nhỏ, nội dung chi tiết cô đọng không rườm rà, rất đáng để đọc",0,2,5,2,5,2,5
5,Tất cả đều ok,0,"1,2,3,4",5,"1,2,3,4",5,"1,2,3,4",5
5,sách okela nhé mn. vừa nhận chụp luôn nên mk ko review được nội dung đâu hehe,0,"2,4",5,"2,4",5,"2,4",5
5,"Mình rất hài lòng về sản phẩm, rất tuyệt vời, cám ơn shop, cám ơn tiki, sẽ đọc cuốn này",0,"2,4",5,"2,4",5,"2,4",5
5,"Nội dung sách dở, mặc dù tiêu đề bìa sách lôi cuốn.",0,2,1,2,3,2,3
5,"Nội dung sách dễ hiểu, đọc có thể tiếp thu đc nhiều thứ, rèn luyện tư duy phản biện có hiệu quả",0,2,5,2,5,2,5
5,bổ ích,0,2,5,2,5,2,5
5,Sách self help giúp tư duy một cách logic tận gốc của vấn đề,0,2,5,2,5,2,5
5,Uy tín,0,"0,2",5,"0,2",5,"0,2",5
5,Rất bổ ích,0,2,5,2,5,2,5
5,Góc nhìn đa chiều,0,2,5,2,5,2,5
5,Hài lòng. Sách gói cẩn thận,0,4,5,4,5,4,5
5,Sách không có seal =(( May mà hộp không móp méo gì không thì mình khóc chết,0,4,3,4,2,4,2
5,"sách hời dàn trải, cần 1 cuốn cầm tay chỉ việc",0,2,4,2,5,2,5
5,Vừa đặt hôm qua nay đã có,0,4,5,4,5,4,5
5,Nên rèn tư duy,0,2,5,2,5,2,5
5,Sách bổ ích nhỏ gọn dễ mang bên mình để đọc những lúc rảnh rỗi,0,2,5,2,5,2,5
5,tập đưa những lý thuyết mà sách đưa ra áp dụng vào đời sống thì suy nghĩ của mình được trưởng thành lên 1 bậc đấy mọi người.,0,2,5,2,5,2,5
5,Sách đang đọc được 50% Từ ngữ hơi trừu tượng các bác ạ :((,0,2,3,2,4,2,4
5,Nhỏ gọn dễ mang theo,0,2,5,2,5,2,5
5,Truyện đến tay mình thì có vẻ hơi bị trầy ;-;,0,4,3,4,3,4,3
5,Sách tạm ổn. Đọc thấy đầu óc mở mang thêm.,0,2,5,2,5,2,5
5,Đọc sách nâng cao trí tuệ nè,0,2,5,2,5,2,5
5,Sách bổ ích,0,2,5,2,5,2,5
5,Sách được nhma fodngs gói sơ sài quá hazz,0,"2,4",2,"2,4",5,"2,4",5
5,"sách mỏng, nội dung tạm ổn",0,2,3,2,4,2,4
5,Hàng tất là ok,0,4,5,4,5,4,5
5,10 d 10,0,"1,2,3,4",5,"1,2,3,4",55,"1,2,3,4",55
5,Good book,0,2,5,2,5,2,5
5,"Sách ok, cần thực hành theo nhiều",0,2,5,2,4,2,4
5,"sách không bị xước, rách",0,2,5,2,5,2,5
5,Trình bày bố cục dễ hiểu. Sách nhỏ gọn dễ mang đi.,0,2,5,2,5,2,5
5,bé hơn t nghĩ:)),0,2,5,2,4,2,4
5,sách sịn lúm ạ,0,2,5,2,5,2,5
5,"Sách mua tặng bạn, bạn mình nhận xét là đọc khá ổn",0,2,5,2,5,2,5
5,Mọi người nên mua vì nói nhiều thứ để mình học hỏi,0,2,5,2,5,2,5
5,"Sách nhỏ hơn mình tưởng, cơ mà bị thích cách trình bày, ý là nội dung sách",0,2,5,2,5,2,5
5,sách có nội dung rất hấp dẫn,0,2,5,2,5,2,5
5,Tuyet voi.,0,2,5,2,5,2,5
5,đọc xong để ngẫm mk phản biện ntn,0,2,5,2,5,2,5
5,"hãy, nên đọc để phát triển tư duy, nhận thức",0,2,5,2,5,2,5
5,Cần đọc nhiều lần để hiểu hơn,0,"0,2",5,"0,2",5,"0,2",5
5,Rất oke,0,2,5,2,5,2,5
5,sách có nội dung về kĩ năng mềm vô cùng cần thiết cho gen Z,0,2,5,2,5,2,5
5,Siêu nhanh,0,4,5,4,5,4,5
5,"sách self help, đọc tham khảo",0,2,5,2,5,2,5
5,Bổ ochs,0,2,5,2,5,2,5
5,Chuan sach,0,2,5,2,5,2,5
5,sách ok lắm nha mọi người,0,"2,4",5,"2,4",5,"2,4",5
5,sách không có màng bọc chống sước,0,4,3,4,3,4,3
5,rất đỉnh luôn ạ cảm ơn shop rất nhiều,0,2,5,2,5,2,5
5,Ờ dậy đó,0,0,5,0,5,0,5
5,sách bọc kĩ kh bị gì hết ạ,0,4,5,4,5,4,5
5,rất bổ ích,0,2,5,2,5,2,5
5,Sách vừa = 1 gang bàn tay nhé,0,2,5,2,5,2,5
5,Mọi thứ ok,0,2,5,2,5,2,5
5,khó hiểu lắm,0,2,1,2,3,2,3
5,sp tot,0,2,5,2,5,2,5
5,Đóng gọi hơi tệ,0,4,2,4,2,4,2
5,K có bọc sách bên ngoài,0,4,2,4,3,4,3
5,Sách có góc nhìn đa chiều.,0,2,5,2,5,2,5
5,нач нач,0,2,5,2,5,2,5
5,sach huu ich,0,2,5,2,5,2,5
5,hàng chuẩn,0,2,5,2,5,2,5
5,rất bổ ích.,0,2,5,2,5,2,5
5,Nội dung ok,0,2,5,2,5,2,5
5,Sách rất giúp ít cho bản thân,0,2,5,2,5,2,5
5,rất biết ơn,0,2,5,2,5,2,5
5,học hỏi được nhiều điều từ sách,0,2,5,2,5,2,5
5,nên bọc kĩ hơn nha,0,4,4,4,4,4,4
4,Cải thiện khả năng tư duy ngôn ngữ,0,2,5,2,5,2,5
5,sách tuyệt vời,0,2,5,2,5,2,5
5,"sách hơi nhỏ vs mỏng hơn kỳ vọng, đang đọc",0,2,4,2,4,2,4
5,"Bọc sách cẩn thận , cảm ơn shop",0,4,5,4,5,4,5
5,sách không thực tế lắm. đọc cho biết,0,2,2,2,3,2,3
5,"Đã nhận sách, thấy hài lòng",0,"2,4",5,"2,4",5,"2,4",5
5,Sản phẩm rất oke nha mọi người.,0,"2,4",5,"2,4",5,"2,4",5
5,sách ok nha mn,0,"2,4",5,"2,4",5,"2,4",5
5,Mình khá thích cuốn này,0,2,5,2,5,2,5
5,vì nó giúp t,0,0,5,0,5,0,5
5,Nói chung rất oke,0,2,5,2,5,2,5
5,Can doc,0,2,5,2,5,2,5
5,Giúp thấu hiểu chính mình,0,2,5,2,5,2,5
5,không gấp bìa,0,4,3,4,5,4,5
5,ok men,0,"0,2",5,"0,2",5,"0,2",5
5,Tạm ổn,0,2,4,2,4,2,4
5,quá đã,0,2,5,2,5,2,5
5,đã nhận sách,0,4,5,4,5,4,5
5,Mãi iu,0,2,5,2,5,2,5
5,"thấy chung chung, đọc k hấp dẫn lắm",0,2,2,2,3,2,3
5,oke nha,0,2,5,2,5,2,5
5,nên mua để đọc,0,2,5,2,5,2,5
5,sách chuẩn,0,2,5,2,5,2,5
5,đáng đọc,0,2,5,2,5,2,5
5,khá ok,0,2,5,2,5,2,5
5,Cungz đc,0,2,5,2,4,2,4
5,Sách bổ ích nha,0,2,5,2,5,2,5
5,Sách chuẩn,0,2,5,2,5,2,5
5,Rất đáng đọc,0,2,5,2,5,2,5
5,ok nhé shop,0,"2,4",5,"2,4",5,"2,4",5
5,Ok la,0,"2,4",5,"2,4",5,"2,4",5
5,Nội dung oke,0,2,5,2,5,2,5
5,Bìa hơi xước,0,4,4,4,3,4,3
5,sách rất bổ ích,0,2,5,2,5,2,5
5,ok shop,0,"2,4",5,"2,4",5,"2,4",5
5,y bài,0,0,5,0,5,0,5
5,Ok good,0,"2,4",5,"2,4",5,"2,4",5
5,cực kì hài lòng,0,2,5,2,5,2,5
5,10 điểm,0,"2,4",5,"2,4",5,"2,4",5
5,ok good,0,"2,4",5,"2,4",5,"2,4",5
5,Hàng Ok,0,4,5,4,5,4,5
5,rất hài lòng sản phẩm của shop,0,2,5,2,5,2,5
5,Rất hài lòng. Cảm ơn tiki,0,"2,4",5,"2,4",5,"2,4",5
5,Hàng ok!,0,4,5,4,5,4,5
1,Sách bị súc hết keo toàn bộ sách,0,4,1,4,1,4,1
4,"nội dung thì có vấn đề gì chỉ là phần câu hỏi cho người đọc để phần giấy nhiều quá, sách đã mỏng rồi còn toàn giấy trắng tính nội dung chả bao nhiêu.",0,2,3,2,3,2,3
4,"mở ra mà sốc ngang luôn á trời , sách không bao gì luôn , cứ vậy mà bỏ vô hộp , trầy trụa tùm lum",0,4,1,4,1,4,1
3,"Sản phẩm không được bọc kĩ, dính bụi, vết bẩn, bìa sách nhăn ít chỗ",0,4,1,4,3,4,3
1,"Gói sách ko cẩn thận, nhận đc sách bị nhăn, xước bìa, bụi bẩn",0,4,1,4,1,4,1
4,Thích. Đào sâu tâm lý đa chiều. Rất thú vị,0,2,5,2,5,2,5
4,Bìa sách bị nhăn với bị lỗ gì í mình không hài lòng lắm,0,4,2,4,2,4,2
1,bị bóc seal :) hơi thất vọng,0,4,1,4,1,4,1
4,Sách hơi dơ xíu,0,4,2,4,3,4,3
3,nó cứ sao sao í mks nghĩ nó dầy lắm mỏng bé lần mua sách ko ưng lắm,0,2,2,2,1,2,1
4,"Nội dung hấp dẫn,",0,2,5,2,5,2,5
4,"Sách gói ko được kỹ, ko bọc j cả chỉ cho vào hộp dẫn đến tình trạng gấp mép giấy",0,4,2,4,1,4,1
4,vì ko có bao sách nên bìa bị xước ạ TT,0,4,2,4,2,4,2
3,Nội dung khá chung chung. Không có nhiều điểm nhấn. Đọc xong trôi toẹt hết.,0,2,2,2,2,2,2
5,sách hơi bị sước và còn k được bọc gì ngoài mỗi hộp bên ngoài,0,4,2,4,2,4,2
4,"Không bọc chống sốc, sướt bìa",0,4,2,4,2,4,2
1,Cấn Trầy Tùm Lum. Cuốn Này Là Cuốn Cuối Cùng,0,4,2,4,2,4,2
4,"Sách không bọc, dễ bị móp",0,4,2,4,2,4,2
1,Sước hết sách luôn chán:),0,4,1,4,2,4,2
3,Sách không đến nổi xuất sắc,0,2,3,2,3,2,3
3,"Sách nội dung hơi trừu tượng, chắc giành cho ai thích khoa học nghiên cứu về não bộ",0,2,3,2,3,2,3
1,Sách bị thiếu trang ở phần cuối,0,2,1,2,2,2,2
3,không gói bọc gì cả cứ vậy bỏ vào hộp làm phần đầu sách bị nhăn.,0,4,2,4,2,4,2
4,mặt sách xước,0,4,2,4,3,4,3
3,sách hơi khó đọc nhé mọi người,0,2,2,2,3,2,3
3,Sách không có ý tưởng gì. Viết kiểu bôi ra chữ cho đủ.,0,2,2,2,3,2,3
2,gói k cẩn thận méo quăn hết sách,0,4,2,4,1,4,1
4,không có bookcare gì nên sách bị xước với móp,0,4,2,4,1,4,1
1,Nội dung sách không giống tiêu đề lắm,0,2,2,2,3,2,3
4,trừ 1 sao vì gói hàng không chống sốc,0,4,4,4,4,4,4
1,"Nội dung quá ít, ko rõ ràng. Thêm vào quá nhiều trang trắng.",0,2,2,2,2,2,2
2,Nội dung sách quá lan man. Rất khác so với tiêu đề. Mình cảm thấy không nên mua nó.,0,2,2,2,3,2,3
1,Cửa hàng làm ăn thất tín quá. K tin nổi luôn Á,0,"2,4",1,"2,4",1,"2,4",1
3,gói hàng không cẩn thận..,0,4,2,4,2,4,2
1,"Sách dở, giấy dổm dễ sợ.?",0,2,1,2,2,2,2
4,"Sách k có bọc bên ngoài nên bìa bị trầy xước, may bên trong k sao.",0,4,2,4,4,4,4
3,chắc phải đọc rất nhiều lần.,0,2,5,2,5,2,5
4,Trừ do dodng gói,0,4,3,4,3,4,3
4,Rất ok,0,"1,2,3,4",5,"1,2,3,4",5,"1,2,3,4",5
4,sách bị bẩn nha,0,2,2,2,3,2,3
3,sách bị xước không dc bọc kỹ,0,4,2,4,2,4,2
