title,content,type,aspect,assess,aspect1,assess1,aspect2,assess2
5,Nồi nấu cơm rất tiện,5,2,5,2,5,2,5
5,"Nấu nhanh mềm, dễ sử dụng có điều hơi nhỏ.",5,2,4,2,4,2,4
5,Fjucbnvc n,5,,,,,,
5,Like like like,5,,,,,,
4,Nồi dễ xước chống dính,5,2,2,2,2,2,2
4,Chờ thời gian,5,0,4,0,4,0,4
4,Hài lòng với sản phẩm,7,"1,2,3,4",5,"1,2,3,4",5,"1,2,3,4",5
5,Vừa đep vừa êm,7,2,5,2,5,2,5
5,Phù hợp,7,2,4,2,4,2,4
3,"Mềm quá, gối mỏng, tựa lưng khó cố định",7,2,2,2,2,2,2
5,good :v,7,"1,2,3,4",4,"1,2,3,4",4,"1,2,3,4",4
5,Ổn áp. good,7,"1,2,3,4",4,"1,2,3,4",4,"1,2,3,4",4
5,Tiện lợi với nhu cầu thanh toán.,7,2,4,2,4,2,4
3,"ko nhận biết đc xe của khách, để khách chờ suốt 3h trong khi xe đã làm xong từ trước",7,1,1,1,1,1,1
5,"THẤM HÚT GIẦU HIỆU QUẢ, DỄ DÀNG SỬ DỤNG",6,2,5,2,5,2,5
5,Tẩy trang sạch không gây kích ứng,6,2,5,2,5,2,5
5,Ko mùi,6,2,4,2,4,2,4
5,Xài rất ok,6,2,5,2,5,2,5
5,xài ok,6,2,5,2,5,2,5
5,khá là okk đo,6,2,5,2,5,2,5
5,"San pham min & dai, tien loi khi su dung. Giup lam sach da & ko lam troi lop trang diem",6,2,5,2,5,2,5
5,Sp rất ok,6,2,5,2,5,2,5
5,giấy thấm dầu acness.,6,2,4,2,4,2,4
5,rất rất hài lòng về sp này.!,6,2,5,2,5,2,5
2,"Khó lấy, quá mỏng sd không êm",6,2,2,2,2,2,2
4,tạm đc,6,2,3,2,3,2,3
3,Tạm ổn.,6,2,3,2,3,2,3
3,Tam duoc. Phai xai tu 2-3 to mot lan,6,2,3,2,3,2,3
5,sp rất ok,8,2,4,2,4,2,4
1,"Vải nóng và bí, nilon thô",8,2,2,2,2,2,2
5,quá ưng luôn,8,"1,2,3,4",5,"1,2,3,4",5,"1,2,3,4",5
3,"Vải thô cứng, dày và mặc khá nóng, chắc hợp với thời tiết mùa đông",8,2,3,2,3,2,3
4,Aida chất vải mặc hơi nóng,8,2,3,2,3,2,3
4,Sp cung ok,8,2,4,2,4,2,4
5,Ok quà tặng tuyệt vời cho bạn,8,2,5,2,5,2,5
5,"Ok, xai không bị đau tai",4,2,4,2,4,2,4
5,Tai nghe âm thânh ok,4,2,4,2,4,2,4
5,Nghe âm thanh rất sướng và phê,4,2,5,2,5,2,5
5,Ấm nghe lâu ok,4,2,4,2,4,2,4
5,Tai nghe nghe rất mượt,4,2,5,2,5,2,5
5,Tai nghe khá ổn nghe lâu thì hơi nên đổi sang núm mềm,4,2,3,2,3,2,3
5,Hàng ok đấy,4,2,4,2,4,2,4
5,Tai nghe xài ok,4,2,4,2,4,2,4
5,rất ổn,4,2,4,2,4,2,4
5,Hai long,4,"1,2,3,4",5,"1,2,3,4",5,"1,2,3,4",5
5,Chống ồn tệ,4,2,2,2,2,2,2
5,Âm thanh cực êm nha mấy bồ,4,2,5,2,5,2,5
5,Nghe phê lòi,4,2,5,2,5,2,5
5,Nghe ổn,4,2,4,2,4,2,4
5,Tai nghe bay,4,2,4,2,4,2,4
5,"Sản phẩm ổn, bass đầm",4,2,4,2,4,2,4
5,"Sản phẩm xài ok lắm, mọi người nên mua nhé",4,2,4,2,4,2,4
5,"Nghe thích, dễ chịu",4,2,5,2,5,2,5
5,"Đập ù hết tai, nghe sướng",4,2,5,2,5,2,5
5,"tai nghe ổn, chống mất cắp",4,2,4,2,4,2,4
5,tai nghe sử dụng ổn!,4,2,4,2,4,2,4
5,mình sài thấy khá ổn,4,2,4,2,4,2,4
5,lâu lâu bị giật,4,2,2,2,2,2,2
5,nghe thích lắm luôn,4,2,5,2,5,2,5
5,rất ưng ý,4,"1,2,3,4",5,"1,2,3,4",5,"1,2,3,4",5
5,ok nghe rât ok,4,2,4,2,4,2,4
5,Dây nhỏ.,4,2,5,2,5,2,5
5,Nghe êm tai,4,2,5,2,5,2,5
5,ok nghe ổn,4,2,4,2,4,2,4
5,nghe ổn phết,4,2,5,2,5,2,5
5,Sản phẩm Oke. Bass hơi to,4,2,4,2,4,2,4
5,tai nghe ok lắm mn ạ,4,2,4,2,4,2,4
5,tai nghe nhạc rất thích,4,2,5,2,5,2,5
5,nghe tốt,4,2,5,2,5,2,5
5,Rất tuyệt ạ.,4,"1,2,3,4",5,"1,2,3,4",5,"1,2,3,4",5
4,"Tai nghe nhỏ, gọn, dễ cho hộp và đeo ko bị đau tai khi nằm. Hơi thiên về bass, nhịp khá đập, phù hợp với nghe nhạc nổi.",4,2,5,2,5,2,5
1,"Chê nha , dây lỏng lẻo nghe nhạc chán dã man thua tai nghe 50k nữa :)",4,2,1,2,1,2,1
4,Âm thanh bị nặng cứ ảo ảo nghe khá choáng,4,2,2,2,2,2,2
1,bị lỗi nhảy bài hát lung tung khi cắm vào điện thoại và để điện thoại vào túi quần. thử loại tai nghe khác thì không bị gì.,4,2,2,2,2,2,2
1,"Sản phẩm mua lần 1 sử dụng ok dã man, mua lần 2 xài tệ ghê nơi.",4,2,2,2,2,2,2
1,"1 tai nghe rõ, 1 tay bị lỗi rè rè k nghe rõ dc. !",4,2,1,2,1,2,1
1,"Đầu dây lỗi, cắm vào máy tính lúc nhận lúc không. Màu nhạt hơn trong ảnh nhiều.",4,2,2,2,2,2,2
4,San phẩm ổn,4,2,4,2,4,2,4
4,"Sử dụng không quen, nói người khác không nghe được hichic",4,2,2,2,2,2,2
2,"Tai nghe vừa nhận đã bị rè mất tai bên phải, nghe rất khó chịu.",4,2,1,2,1,2,1
4,Hàng ok,4,2,4,2,4,2,4
3,"Tai nghe ko tương thích với IP, cắm vào nghe rất rè ko rõ",4,2,1,2,1,2,1
4,"sản phẩm ổn định, nghe rõ nhạc",4,2,4,2,4,2,4
4,"Tạm ổn, dây hơi nhỏ.",4,2,3,2,3,2,3
3,1 bên nghe lớn 1 bên nghe nhỏ,4,2,2,2,2,2,2
1,tiếng nghe bên to bên nhỏ. nhiều khi không nghe được,4,2,2,2,2,2,2
4,Tai bên trái nghe ko rõ bằng tai bên phải,4,2,2,2,2,2,2
4,nghe được,4,2,3,2,3,2,3
1,dây dễ bị đứt nên đừng mua,4,2,1,2,1,2,1
4,"nghe rè, k ổn lamw",4,2,2,2,2,2,2
4,nói chung là ổn,4,2,4,2,4,2,4
4,Bị rè rè chỗ mic ạ?,4,2,2,2,2,2,2
2,hàng ko đúng nhu quảng cáo,4,2,1,2,1,2,1
5,"đúng mô tả, sp ok",10,2,4,2,4,2,4
5,Xài okie lắm nha,10,2,4,2,4,2,4
4,San pham dung tot lam,10,2,5,2,5,2,5
5,chất thun mè dày oke,10,2,4,2,4,2,4
4,Ok tạm ổn,10,2,3,2,3,2,3
5,áo chật quá. cho mình xin đổi size,10,"1,2",2,"1,2",2,"1,2",2
4,không có size để lựa chọn nên áo mặc không được thoải mái lắm,11,2,2,2,2,2,2
4,hang ok,11,2,4,2,4,2,4
5,Đáng mua,11,"2,3",4,"2,3",4,"2,3",4
2,"Áo giặt ra màu , ko nên giặt ching vs đồ khác :(",11,2,2,2,2,2,2
5,sp rất là phù với tôi,11,2,5,2,5,2,5
5,dẹp hơi mỏng,11,2,3,2,3,2,3
5,hàng ok lắm nha,11,2,4,2,4,2,4
5,sản phẩm mặc đi chơi và du lịch ọ,11,2,4,2,4,2,4
5,ok với sản phẩm,11,2,4,2,4,2,4
5,Gút Chóp :v,11,"1,2,3,4",5,"1,2,3,4",5,"1,2,3,4",5
5,quan dep dung nhu hinh quan cao,11,2,5,2,5,2,5
5,"vải rất mát, 57kg mặc size L rất vừa, rất hài lòng",11,2,5,2,5,2,5
5,viền phía sau quần không được ôm lắm,11,2,3,2,3,2,3
5,Ok đó,11,2,4,2,4,2,4
5,Mặc thoải mái khá ưng,11,2,5,2,5,2,5
5,nen mua mn oi,11,2,4,2,4,2,4
5,Ìe týb,11,,,,,,
5,tot nhu hinh. ok,11,2,4,2,4,2,4
5,chất liệu ok,11,2,4,2,4,2,4
5,tạm được.,11,2,3,2,3,2,3
5,hàng rất ok,11,2,4,2,4,2,4
1,mình đặt size XXL mà s shop toàn gửi mình size S vậy. Mặc k vừa,11,"1,2",1,"1,2",1,"1,2",1
3,Bận nó nhanh dản quá đi mất,11,2,2,2,2,2,2
3,Ok mình nhận rồi nhé Hàng ok lắm,11,"2,4",4,"2,4",4,"2,4",4
3,binh thuong trong tam gia,11,"2,3",3,"2,3",3,"2,3",3
5,"thought-provoking, best fit you just went through sth bad",12,0,3,0,3,0,3
5,Thoáng mát,11,2,5,2,5,2,5
5,Quần mặc rất mát,11,2,5,2,5,2,5
5,"Shop thân thiện, màu ngẫu nhiên kho được chọn 4,5/ 5*. sẽ ủng hộ tiếp",11,1,5,1,5,1,5
5,mặc ổn.,11,2,4,2,4,2,4
5,"Màu hơi khác so với ảnh, chất quần mặc rất thoải mái, Mát. ok",11,2,4,2,4,2,4
5,Good !,11,"1,2,3,4",4,"1,2,3,4",4,"1,2,3,4",4
5,"chất vải mát- màu tạm ổn, nhìn chung hài lòng..,",11,2,4,2,4,2,4
5,"Rat thich. Chat lieu vao men, thoang",11,2,5,2,5,2,5
5,"Quần mặc mát, size vừa vặn",11,2,5,2,5,2,5
5,Rất vừa lòng,11,"1,2,3,4",5,"1,2,3,4",5,"1,2,3,4",5
1,"Hàng Mấy 10, khổng phải của shop. Mỏng",11,2,2,2,2,2,2
4,vải mỏng,11,2,2,2,2,2,2
4,rất ưng,11,"1,2,3,4",5,"1,2,3,4",5,"1,2,3,4",5
5,Cute bookmark,12,2,5,2,5,2,5
3,"Book papers are not good, easily teared",12,2,2,2,2,2,2
5,"Mua chung với bánh biscotti vị nguyên cám 100g và bánh gạo lứt vị huyết rồng (170g) shop đóng hàng tuyệt vời, có chống va đập. Điểm cộng cho sự tinh tế là tặng kèm sản phẩm 1 kẹp gỗ để bảo quản bánh gạo, 10đ. Thu gọn",9,"1,4",5,"1,4",5,"1,4",5
5,"Bao bì đơn giản, bún chế biến dễ, ăn ngon. Mình mua cả 2 loại gạo lứt đen và huyết rồng ăn thử.",9,2,5,2,5,2,5
5,Bún gạo lứt ăn kiêng giảm cân thực dưỡng ăn nhanh ăn liền bún lứt huyết rồng 500g Mua ngay ok la,9,2,4,2,4,2,4
5,Bún mềm ngon. Chỉ có cái trụng hơi lâu xí. Về cơ bản mình cảm thấy hài lòng. Tiện lợi,9,2,5,2,5,2,5
5,"đủ số lượng, ngon thì m sẽ mua tiếp",9,2,4,2,4,2,4
5,"Bún gạo lứt ăn ngon, dai không bị bở, ngâm nước và nấu hơi lâu.",9,2,5,2,5,2,5
5,"Bún ngon, dai, khô nên nấu nở rất nhiều",9,2,5,2,5,2,5
5,Mua bún gạo lứt đen dc tặng bánh tráng. Bún rất ngon,9,"1,2",5,"1,2",5,"1,2",5
5,rất ngon và vừa miệng,9,2,5,2,5,2,5
5,tạm được.,9,2,3,2,3,2,3
5,Bún ngon lắm,9,2,5,2,5,2,5
5,Ngon nha,9,2,5,2,5,2,5
5,"Sợi bún đậu, ko bị bở",9,2,5,2,5,2,5
5,Cái này ngon lắm ạ,9,2,5,2,5,2,5
5,Nói chung là hài lòng nhe quý dị ?,9,"1,2,3,4",5,"1,2,3,4",5,"1,2,3,4",5
5,Dễ ăn,9,2,4,2,4,2,4
5,"ăn ngon,ổn sẽ mua ủng hộ tiếp",9,2,4,2,4,2,4
5,bún ngon,9,2,5,2,5,2,5
5,nấu sợi dai rất ngon,9,2,5,2,5,2,5
5,"Ăn ngon, dai.",9,2,5,2,5,2,5
5,Sf ổn,9,2,4,2,4,2,4
5,rất ngon lun,9,2,5,2,5,2,5
5,"Bún dễ ăn , ngon , hợp khẩu vị mình",9,2,5,2,5,2,5
5,"hàng ăn ngon, OK",9,2,4,2,4,2,4
5,Bún rất ngon. Sẽ ủng hộ tiếp sau khi mình ăn hết,9,2,5,2,5,2,5
5,Rất ngon,9,2,5,2,5,2,5
5,bún rất ngon,9,2,5,2,5,2,5
5,Ăn rất ngon,9,2,5,2,5,2,5
5,Bánh ăn ngon,9,2,5,2,5,2,5
5,Ok lắm nha,9,2,4,2,4,2,4
5,Bún ăn ngon,9,2,5,2,5,2,5
5,ăn ngon,9,2,5,2,5,2,5
5,"Bún ăn ngon, dai",9,2,5,2,5,2,5
5,"Ngon lém, bún k bị nở sau khi luộc",9,2,5,2,5,2,5
5,Bún dai & ngon. Ủng hộ GU.,9,2,5,2,5,2,5
5,rất ngon,9,2,5,2,5,2,5
5,Ok ngon,9,2,5,2,5,2,5
5,Thích hợp để ăn kiêng,9,2,5,2,5,2,5
5,Dai và lành mạnh,9,2,5,2,5,2,5
5,sản phẩm ok nhé,9,2,4,2,4,2,4
5,Ăn rất ngon!,9,2,5,2,5,2,5
5,Ngon nhé,9,2,5,2,5,2,5
5,ngon lắm,9,2,5,2,5,2,5
4,Bún sợi dai ngon,9,2,5,2,5,2,5
1,"So với Be thì k bằng,Be số 1",9,2,3,2,3,2,3
5,"nấu lâu, bún dai, ngon",9,2,5,2,5,2,5
3,ăn hơi có mùi hôi của dán,9,2,2,2,2,2,2
4,"bún ăn ngon lắm,",9,2,5,2,5,2,5
5,good nak,13,"1,2,3,4",5,"1,2,3,4",5,"1,2,3,4",5
5,Super quality and awesome price!,13,"2,3",5,"2,3",5,"2,3",5
5,"Ngon màu sắc ổn, ace làm mmo có thể mua",13,2,4,2,4,2,4
1,Tốc độ tạm được ok,13,2,4,2,4,2,4
5,dép đi nhẹ và bền đẹp.,14,2,5,2,5,2,5
5,Dép nhẹ. Mang êm,14,2,5,2,5,2,5
4,"Dép nhẹ, mang êm",14,2,5,2,5,2,5
5,"Dép nhẹ, đi êm",14,2,5,2,5,2,5
5,hài lòng với sản phẩm,14,"1,2,3,4",5,"1,2,3,4",5,"1,2,3,4",5
5,uy tín,14,2,5,2,5,2,5
4,"làm ơn cho xin hoá đơn VAT theo thông tin đã cung cấp trong đơn mua hàng, xin cảm ơn",15,1,5,1,5,1,5
5,"quá vừa vặn, dép da rất mềm, khâu rất tỉ mỉ, đi êm chân.",14,2,5,2,5,2,5
5,Dep dep. Cug ok,14,2,4,2,4,2,4
5,Dép mang êm.,14,2,5,2,5,2,5
5,"Cám ơn và chúc mừng Tiki vi tôi nhận thấy quý vị rất trân trọng chữ TÍN. Bởi vậy, không có lý do nào để tôi có thể từ chối nhấn năm sao.",14,1,5,1,5,1,5
5,Hàng chuẩn,14,2,5,2,5,2,5
5,mang rất êm chân,14,2,5,2,5,2,5
4,"2 chiếc độ rộng không đều . Chiếc rộng , chiếc hẹp.1 chiếc bó chân quá",14,2,2,2,2,2,2
2,đế dép quá dầy và nặng quá,14,2,2,2,2,2,2
4,đế đi êm,14,2,5,2,5,2,5
4,dép rất đẹp.,14,2,5,2,5,2,5
5,Mọi thứ đều on,16,"1,2,3,4",5,"1,2,3,4",5,"1,2,3,4",5
5,"Minh di size 39 rong, shop co the doi cho minh size 38 duoc khong? Cam on shop",16,"1,2",3,"1,2",3,"1,2",3
5,Dep êm. Vua văn nhe,16,2,5,2,5,2,5
1,ko nên nói là đi đc trong nhà tắm nhé đi tring nhà tắm rất trơn và nguy hiểm chỉ đi trong nhà thì đc,16,2,2,2,2,2,2
5,Cứng cáp. Dễ xoay TV. Đinh với khung treo cứng cáp. Khoan tường bê tông lỗ 10. Tự làm phải cần 2 ng.,15,2,5,2,5,2,5
5,"chuẩn, 5 star",15,"1,2,3,4",5,"1,2,3,4",5,"1,2,3,4",5
5,Sản phẩm xuất sắc,15,2,5,2,5,2,5
5,Phù hợp với tivi 55 inch,15,2,4,2,4,2,4
5,"OK, đừng chắc lắm",15,2,4,2,4,2,4
5,Tiện lợi góc xoay,15,2,5,2,5,2,5
5,"Giày vừa chân, mang êm nha cả nhà",16,2,5,2,5,2,5
5,Hàng ok Nói chung khá hài lòng,16,2,4,2,4,2,4
5,"size đúng, da mềm, đi rất thích",16,2,5,2,5,2,5
5,giày mang êm chân,16,2,5,2,5,2,5
5,Oke ike,16,"1,2,3,4",4,"1,2,3,4",4,"1,2,3,4",4
5,Giày rất mềm.,16,2,5,2,5,2,5
2,Hinh ảnh trên tiki giay cao 3f sao shop gao giay 1f shop oi,16,"1,2",2,"1,2",2,"1,2",2
4,mũi giày đi bị đen chân,16,2,2,2,2,2,2
4,Rất hài lòng,16,"1,2,3,4",5,"1,2,3,4",5,"1,2,3,4",5
3,Giày mềm zôm và hạnh phúc c em nhé các chị,16,2,5,2,5,2,5
4,giày đi lâu vẫn đau chân,16,2,2,2,2,2,2
4,Moi xài thấy OK không biết có bên không cho 4sao,17,2,4,2,4,2,4
5,Sao em gắn dc nhỉ,17,2,3,2,3,2,3
5,"Hàng chuẩn, lắp cho camera ezviz vừa chuẩn.",17,2,5,2,5,2,5
5,tot hjhjhjhjhj,17,2,5,2,5,2,5
5,ok rat tot,17,"1,2,3,4",5,"1,2,3,4",5,"1,2,3,4",5
5,Ok giá rẻ hàng đẹp,18,"2,3",5,"2,3",5,"2,3",5
5,Hoài lòng,18,"1,2,3,4",5,"1,2,3,4",5,"1,2,3,4",5
1,"Này ngoài chợ 15k 2 đôi, trùm lên đầu đi cướp ngân hàng còn thấy đường.",18,"2,3",2,"2,3",2,"2,3",2
2,Sản phẩm mỏng hơn đăng trên shop,18,2,2,2,2,2,2
2,"Quá mỏng…,….",18,2,2,2,2,2,2
5,Đã nhận được hàng shop làm ăn uy tín.Chấm shop 5 sao.,18,"1,4",5,"1,4",5,"1,4",5
5,san pham dinh duong tuyet voi,19,2,5,2,5,2,5
5,"xuất sắc, áp chảo ăn vị rất vừa miệng",19,2,5,2,5,2,5
5,rất ngon nè,19,2,5,2,5,2,5
5,Rất là ngon!,19,2,5,2,5,2,5
5,ngon nhức nách,19,2,5,2,5,2,5
5,"rất là ngon nha, like",19,2,5,2,5,2,5
5,Ngon tươi,19,2,5,2,5,2,5
2,Quảng cáo sản phẩm 2*gr. Thực tế cân chỉ 180gr,19,2,2,2,2,2,2
5,"mình thấy k ngon, mùi khó chịu",19,2,2,2,2,2,2
5,Sản phẩm tốt. Rất hài lòng. Mình mới làm gãy 1 bên gọng buồn quá à,18,2,4,2,4,2,4
5,tôi rất hài lòng với sản phẩm TiKi,18,"1,2,3,4",5,"1,2,3,4",5,"1,2,3,4",5
5,"Mắt kính nhỏ, gọn.",18,2,4,2,4,2,4
5,Kinh đep,18,2,5,2,5,2,5
5,ok á,18,"1,2,3,4",4,"1,2,3,4",4,"1,2,3,4",4
5,kính trẻ em.,18,2,4,2,4,2,4
5,Rất hài long,18,"1,2,3,4",5,"1,2,3,4",5,"1,2,3,4",5
3,"Kình hơi bé, không có gì chứng minh là kính Hàn quốc in trên kính.",18,2,2,2,2,2,2
4,Ảnh mang tc mh,18,0,4,0,4,0,4
1,kính giả. mọi người không nên mua,18,2,1,2,1,2,1
2,Hàng không hài lòng nhỏ xíu,18,2,1,2,1,2,1
2,Kính khác xa so với ảnh tệ,18,2,1,2,1,2,1
2,"gọng cứng, mắt kính bằng nhựa cứng, dễ gãy vỡ.",18,2,2,2,2,2,2
1,Kính hơi nhỏ ko vui lắm hix,18,2,2,2,2,2,2
1,Kính rất bé so với quãng cáo,18,2,2,2,2,2,2
1,Kính bé so với hình quãng cáo,18,2,2,2,2,2,2
3,vẫn sp này đồng nghiệp tôi mua có 50k,18,"2,3",2,"2,3",2,"2,3",2
4,Sản phẩm Ok,18,2,4,2,4,2,4
3,Cung tam duoc thoi à hihi,18,2,3,2,3,2,3
4,ko gi,18,0,3,0,3,0,3
5,Sản phẩm có mùi thơm nhẹ. Bạn mình ưng lắm,20,2,5,2,5,2,5
5,"Vòng trầm có thơm nhẹ , sẽ ủng hộ shop nữa",20,"1,2",5,"1,2",5,"1,2",5
5,"Thơm mùi trầm , ưng bụng lắm",20,2,5,2,5,2,5
5,Ưng ý với sp của shop.,20,2,5,2,5,2,5
5,rất ok luôn nha mọi người Dán r thoa tý nước hình đa dạng,18,2,5,2,5,2,5
5,xúc ki thik,18,,,,,,
5,Xinh lắm luôn!,18,2,5,2,5,2,5
5,Hàng y hình,18,2,5,2,5,2,5
5,Hình giữ được lâu màu sắc in rõ ràng??,18,2,3,2,3,2,3
5,độ bám dính ko cao,18,2,2,2,2,2,2
5,rat tot,18,"1,2,3,4",5,"1,2,3,4",5,"1,2,3,4",5
5,hinh cung dep dung mau rat ok sau nay se ung ho shop,18,"1,2",5,"1,2",5,"1,2",5
5,nhieu hinh. dep phu hop tre em va ca nguoi *.. .,18,2,5,2,5,2,5
4,"Được , hình nhỏ",18,2,4,2,4,2,4
4,Học sinh rất thích,18,2,5,2,5,2,5
2,"Dán không cẩn thận là tróc, dán được không tới 2 ngày là bay",18,2,2,2,2,2,2
2,"Dán kg cẩn thận là tróc, dán được kg tới 2 ngày là bay",18,2,2,2,2,2,2
4,Hình dán dễ bị tróc khi bị dính nước.,18,2,2,2,2,2,2
3,"Mua về cho mấy đứa nhỏ dan chơi, nhìn rất thú vị.. ?",18,2,5,2,5,2,5
1,Khong hinh nao duoc toan hinh tao lao khong nen mua,18,2,1,2,1,2,1
1,"Ko dán được, keo dỏm quá, ko ăn vô da! Chán!",18,2,1,2,1,2,1
5,chất lượng hình giảm nhẹ,18,2,2,2,2,2,2
4,thiếu rất nhiều,18,2,2,2,2,2,2
4,thiếu 1 số hình,18,2,2,2,2,2,2
5,keo mau tróc,18,2,2,2,2,2,2
5,"đúng mô tả, đúng hẹn",21,"2,4",5,"2,4",5,"2,4",5
5,sản phẩm giống mô tả,20,2,5,2,5,2,5
5,Rất ưng ý,20,"1,2,3,4",5,"1,2,3,4",5,"1,2,3,4",5
5,Ok phù hợp,20,2,4,2,4,2,4
5,Dây tương đối dễ xỏ.,20,2,4,2,4,2,4
1,Toàn * đảo. Không thể tin được,22,2,1,2,1,2,1
5,Tuyệt vời luôn,21,"1,2,3,4",5,"1,2,3,4",5,"1,2,3,4",5
5,muốn đổi size nhỏ hơn đc k shop,21,1,5,1,5,1,5
5,Sản phẩm ok nhé! Cảm ơn shop rất nhiều,21,"1,2",5,"1,2",5,"1,2",5
5,good job,21,"1,2,3,4",5,"1,2,3,4",5,"1,2,3,4",5
1,Bán hàng không kiểm tra sản phẩm,21,"1,2",1,"1,2",1,"1,2",1
5,"Phiếu quà tặng thích hợp là món quà dành tặng người thân, bạn bè. Sau khi thanh toán thì người nhận sẽ nhận được voucher ngay.",22,"0,4",5,"0,4",5,"0,4",5
5,"Nhanh, tiện",22,"2,4",5,"2,4",5,"2,4",5
5,Nhanh gọn tiện lợi,22,"2,4",5,"2,4",5,"2,4",5
4,tiện lợi,22,2,5,2,5,2,5
1,thất vọng vô cùng khi nhận sản phẩm túi xách không phải da thật loại cao xu gì rất mỏng quảng cáo da thật mà chẳng giống tí nào mất lòng tin,23,2,1,2,1,2,1
1,túi méo mó quá ko vuông vắn,23,2,2,2,2,2,2
5,truonhwf giống truong truong truong dụng,23,,,,,,
5,okokok.xinh quá ah.mãi iu,23,2,5,2,5,2,5
3,sản phẩm tạm ổn,23,2,3,2,3,2,3
3,"Không có xuất hóa đơn tài chính, bất tiện cho các công ty khi có nhu cầu mua làm quà tặng.",22,1,2,1,2,1,2
3,mua nhầm muốn hủy đơn có đc k ạ,22,1,3,1,3,1,3
1,mua mã xong đổi ngay thì báo vậy? thất vọng mất 200k,22,1,1,1,1,1,1
2,Mua cái phiếu này mà không để ý nhập sai * thôi là ko biết truy hồi ở đâu,22,1,1,1,1,1,1
1,Người nhận báo không nhận được gì cả. Tiki kiểm tra giúp,22,1,1,1,1,1,1
1,:)) không hoàn trả do mình ấn lộn,22,1,1,1,1,1,1
5,ok nhé,22,"1,2,3,4",4,"1,2,3,4",4,"1,2,3,4",4
5,"Sản phẩm rất tiện dụng, hữu ích tặng cho người thân bạn bè.",22,2,5,2,5,2,5
1,Giờ muốn tặng cho người khác làm sao,22,0,3,0,3,0,3
5,"Mua dễ, gửi mã nhanh",22,"1,4",5,"1,4",5,"1,4",5
5,Quá ok khi áp mã.,22,"1,2,3,4",5,"1,2,3,4",5,"1,2,3,4",5
1,Mã thẻ không hợp lệ khi thanh toán ?,22,1,1,1,1,1,1
5,Mã sử dụng đổi tiki xu mua hàng thoải mái,22,2,5,2,5,2,5
5,Dễ sử dụng lắm. Mình rất thích,22,2,5,2,5,2,5
5,Xài được,22,2,4,2,4,2,4
5,ok được hợ lú gh nhanh hmchua,22,4,5,4,5,4,5
5,tôi ko biết làm sao để tt quà,22,1,3,1,3,1,3
4,"Rất ok, khi mua voucher.",22,"1,2",5,"1,2",5,"1,2",5
4,Ok đúng hình ảnh,24,2,5,2,5,2,5
5,Rất hài lòng. Date xa tháng 4 & 5/2022,9,"2,4",5,"2,4",5,"2,4",5
5,"ống hút bằng giấy , hạn sử dụng dài",9,2,5,2,5,2,5
5,ok ạ,9,"1,2,3,4",4,"1,2,3,4",4,"1,2,3,4",4
5,Hàng rất ok,9,2,4,2,4,2,4
5,Con mình thích uống sữa này,9,2,5,2,5,2,5
5,Ok sua ngon bo dương minh thiach,9,2,5,2,5,2,5
5,sữa hsd xa lần sau mình mua tiếp,9,"2,4",5,"2,4",5,"2,4",5
5,Sản phẩm còn hạn sử dụng.,9,2,5,2,5,2,5
5,date dài sữa ngon nên mua,9,"2,4",5,"2,4",5,"2,4",5
5,sản phẩm chất luong,9,2,5,2,5,2,5
5,"Rất ngon, u tăg chiều cao",9,2,5,2,5,2,5
5,Date 22/4/2022,9,2,4,2,4,2,4
5,Tôi hài lòng.,9,"1,2,3,4",5,"1,2,3,4",5,"1,2,3,4",5
5,Hài lòng. Hài lòng và hài lòng.,9,"1,2,3,4",5,"1,2,3,4",5,"1,2,3,4",5
5,chat luong tuyet voi,9,2,5,2,5,2,5
5,Sữa ngon bé mình rất thích,9,2,5,2,5,2,5
5,ok ok ok,9,"1,2,3,4",4,"1,2,3,4",4,"1,2,3,4",4
5,"Hàng chuẩn, date xa",9,"2,4",5,"2,4",5,"2,4",5
5,i like it!,9,"1,2,3,4",5,"1,2,3,4",5,"1,2,3,4",5
5,Thấy bé thích uống,9,2,5,2,5,2,5
5,Hài lòng lắm,9,"1,2,3,4",5,"1,2,3,4",5,"1,2,3,4",5
5,Ngon ạ,9,2,5,2,5,2,5
5,"Tôi hài lòng với sản phẩm này, lần sau sẽ tiếp tục mua",9,"1,2",5,"1,2",5,"1,2",5
5,Sản phẩm này con rất thích uống,9,2,5,2,5,2,5
5,thùng sữa bị mốp ở góc,9,4,2,4,2,4,2
5,Hàng oke,9,2,4,2,4,2,4
5,sữa ngon,9,2,5,2,5,2,5
5,"Sữa ngon , hàng chuẩn",9,2,5,2,5,2,5
5,ok ok,9,"1,2,3,4",4,"1,2,3,4",4,"1,2,3,4",4
5,rất ok mọi người ạ,9,"1,2,3,4",5,"1,2,3,4",5,"1,2,3,4",5
5,Đúng hẹn,9,4,5,4,5,4,5
5,ưng lắm,9,"1,2,3,4",5,"1,2,3,4",5,"1,2,3,4",5
5,Luôn ủng hộ shop!,9,1,5,1,5,1,5
5,Sp ok ạ,9,2,4,2,4,2,4
5,quá tuyêt vời,9,"1,2,3,4",5,"1,2,3,4",5,"1,2,3,4",5
5,uống ngo,9,2,5,2,5,2,5
5,date hơi ngắn tháng 7.2022,9,2,3,2,3,2,3
5,ok ngon rử,9,2,5,2,5,2,5
5,Răt tuyệt,9,"1,2,3,4",5,"1,2,3,4",5,"1,2,3,4",5
5,Gia qua tot,9,3,5,3,5,3,5
5,"Ngày sx hơi xa, nên hạn hơi gần.",9,2,3,2,3,2,3
5,Sp nguyên vẹn k móp méo bể vỡ,9,4,5,4,5,4,5
5,date 8-21,9,2,3,2,3,2,3
5,Dong goi san pham chac chan . Chua dung nen chua biet chat luong san pham nhu the nao,9,4,4,4,4,4,4
5,nhân hàng rất ưng han sử dụng dai han. đóng hàng rất cẩn thận,9,"2,4",5,"2,4",5,"2,4",5
5,"Chính hãng, các con rất thích, thoi hạn lau dài nên yên tâm",9,2,5,2,5,2,5
5,Okokokokeokeokeokeokw San pham y hinh,9,2,5,2,5,2,5
5,rất chuẩn,9,2,5,2,5,2,5
5,Rất hài lòng về sản phẩm này,9,"1,2,3,4",5,"1,2,3,4",5,"1,2,3,4",5
5,Date xa,9,2,5,2,5,2,5
5,hang chuan 5 sao han dung den thang 3 sang nam ung ho tiki ngay cang pt,9,"1,2,4",5,"1,2,4",5,"1,2,4",5
5,gia tot,9,3,5,3,5,3,5
4,ok sane phẩm ok,9,2,4,2,4,2,4
3,Đã nhận dc hàng tuy hơi lâu xíu,9,4,3,4,3,4,3
4,hạn sử dụng còn dài,9,2,5,2,5,2,5
4,sản phẩm okl,9,2,4,2,4,2,4
1,Không thanh toán được đơn hàng nầy,9,1,1,1,1,1,1
1,Không thanh toán đơn hàng được .,9,1,1,1,1,1,1
3,"khong hai long. gia cao, it.",9,"2,3",2,"2,3",2,"2,3",2
4,Ngon lành,9,2,5,2,5,2,5
1,sản phẩm date quá ngắn mất 3/4 thời gian hạn sử dụng,9,2,2,2,2,2,2
1,hạn sử dụng chỉ còn 1tháng,9,2,2,2,2,2,2
4,Hài lòng về sp. mỗi tội ngọt quá.,9,2,4,2,4,2,4
4,sao mình không nhận được hàng tặng lốc milo ăn sáng vậy shop?,9,2,4,2,4,2,4
4,Toi cảm thấy hài lòng với sp nay,9,"1,2,3,4",5,"1,2,3,4",5,"1,2,3,4",5
5,Oki lắm nên mua,25,2,4,2,4,2,4
5,ok quá tiện,25,2,5,2,5,2,5
5,Hàng đúng mô tả,25,2,5,2,5,2,5
5,"Sạch, chính hãng, rất thích",25,2,5,2,5,2,5
4,Dung dịch tẩy sạch cặn canxi và tạp chất bám vào máy mà không cần cọ rửa bằng tay. Tuy nhiên với máy rửa bát nhỏ thì cần phải cho chạy thêm 1 lần rửa không có bát sau đó để hết mùi dung dịch. Nếu mà có chai nhỏ hơn thì sẽ phù hợp với đa số máy rửa bát ở VN hơn. Thu gọn,25,2,4,2,4,2,4
5,"Mùi dễ chịu, rửa sạch, không hại da tay Mình không chụp hình, mọi người thông cảm, mình đăng đỡ hình yến sào Khánh Hoà",25,2,5,2,5,2,5
5,"Rửa sạch, không mùi, ko hại da tay.",25,2,5,2,5,2,5
5,"Sản phẩm thơm, không mùi hoá học, không khô da tay ., dễ chịu",25,2,5,2,5,2,5
5,"Rửa sạch, an toàn",25,2,5,2,5,2,5
5,"Xài ổn, không khỏi da tay",25,2,4,2,4,2,4
5,tôi rất hài lòng với sản phẩm,25,"1,2,3,4",5,"1,2,3,4",5,"1,2,3,4",5
5,Nước rửa tay thơm nhẹ và dễ chịu,25,2,5,2,5,2,5
5,Nước rửa chén ok lắm,25,2,4,2,4,2,4
5,Xài không khô tay và rửa rất sạch,25,2,5,2,5,2,5
5,Tất hài lòng,25,"1,2,3,4",5,"1,2,3,4",5,"1,2,3,4",5
5,Rất hài lòng cảm ơn tiki,25,1,5,1,5,1,5
5,sản phẩm xài ok,25,2,4,2,4,2,4
5,An tâm,25,2,5,2,5,2,5
4,"Khá sạch, mùi dễ chịu",25,2,5,2,5,2,5
4,bọt ít k sạch dầu mỡ,25,2,2,2,2,2,2
4,Rửa sạch,25,2,5,2,5,2,5